FIRSTCONTACT_WELCOME,Hey - looks like you're a little lost.,daemon,,quests/ada-intro,
FIRSTCONTACT_WELCOME_HINT1,Check out that pulsing button on the left!,daemon,,,
FIRSTCONTACT_GOAL,"Now that you've flipped the door, let's hack it open. ",daemon,,,
FIRSTCONTACT_GOAL_HINT1,Try moving the sliders and seeing what happens.,daemon,,,
FIRSTCONTACT_GOAL_HINT2,Keep going! Maybe the door will unlock if you fit the *wave* into the *groove*...,daemon,,,
FIRSTCONTACT_FLIPBACK,Nice job!,daemon,,,
FIRSTCONTACT_FLIPBACK_HINT1,"Click the Flip to Hack button again to return, now that you've hacked the door open.",daemon,,,
