T2TANK_QUEST_NAME,Terminal 2 - Tank Warriors,,,,
T2TANK_GREET1,"This one's always a hit - ha, ha. Tank Warriors is another part of the Terminal 2 Network.

You can also launch this game through the Pathways or the Desktop.",saniel,,,
T2TANK_GREET2,"Did you know that in the early 1900s, 'tank' was originally meant to be a code-name?

It was used to fool the enemy into thinking that these new 'tanks' were just for hauling water or gasoline. Clever.",saniel,,,
T2TANK_NOTINSTALLED,"Uh-oh! I'm detecting that `Tank Warriors` isn't installed!

You need to download it from the App Center if you want to play.

Click the icon named `More Apps` on the Desktop, then search for the program you want to install.",daemon,,,
T2TANK_QUEST_SUBTITLE,What you'll do,,,,
T2TANK_QUEST_DESCRIPTION,"Design, program, or pilot a tiny tank to victory!",,,,
